,0
0,Live updates
1,Vaccination tracker
2,Daredevil dies
3,Huge diamond
4,Victoria's Secret
5,Naomi Osaka
6,'House from hell'
7,China is innoculating its citizens against Covid-19 on a scale and speed unrivaled by any other country in the world
8,Virus outbreak clogs China's ports. That could affect your holiday season
9,"'House from hell' listed for $600,000 gets multiple all-cash offers"
10,"They were split by Covid for 8 months, until they found a street at the border"
11,Daredevil Alex Harvill dies in practice for world record motorcycle jump
12,"Wolves chase performers in China during shocking live show, raising safety fears"
13,America's new national holiday sets off scramble to shut down governments
14,They work abroad to feed their families. Now they can't send the money home
15,Analysis: The 30 most bizarre lines from Trump's latest interview with Hannity
16,"CNN anchor: One of most embarrassing, glaring failures for ICC"
17,Analysis: The Republican Party's mission: Whitewash the Trump presidency
18,Osaka joins Nadal in pulling out of Wimbledon
19,Christian Eriksen to receive heart starter
20,'WKRP in Cincinnati' actor dies at age 79
21,'Murder hornet' found near Seattle is the first US sighting in 2021
22,Iranians vote in an all but decided presidential election
23,"1 dead, 8 hospitalized in Arizona shootings"
24,11-year-old cross-examined by father in Florida murder trial
25,"'It is obscene,' Chimamanda Adichie says in new essay on social media cancel culture"
26,One of the world's largest diamonds has been unearthed
27,Watch mesmerizing sight of blooming flowers
28,Memes and free beer: Golf spat goes viral
29,"Sperm count not harmed by Covid-19 vaccine, study says"
30,Financial markets are moving into a new era
31,Alaska Airlines reveals new Pride-themed livery
32,Victoria's Secret overhauls its image. Is it enough to regain relevance?
33,Estonia is a global leader on all things cyber. Now it's offering to teach other countries
34,Medieval Europeans regularly reopened graves — and not to rob them
35,Genderless African fashion hits the world stage
36,How Italy changed Stanley Tucci forever
37,New tech gives surgeons 'superpowers'
38,South Korea Paralympic basketball team inspired by coach who died of cancer
39,Giant Buddhist goddess in Japan gets face mask to pray for end of Covid-19
40,Stray dog is unrecognizable after 6 pounds of hair is removed
41,CDC lowers warning level for cruise travel
42,"Opinion: As a scientist, I want to believe in UFOs, but ..."
43,'So... how ya been?': Stephen Colbert welcomes an audience back to 'The Late Show'
44,"Attacked, rejected and harassed: Asians around the world speak out on workplace discrimination"
45,160-year-old corporate giant PwC is getting a serious makeover
46,Europe ramps up pressure on tech giants
47,Silicon Valley may look very different after the pandemic
48,The world's 'coolest' street revealed by Time Out
49,Covid lifted Prague's hangover. Now the city wants to quit partying
50,10 of the world's best hotels for when it's time to splurge
51,New UK travel rules: It's complicated
52,The exotic island paradise off the coast of England
53,Everything you need to know about the EU's new Covid 'passport'
54,How a nation of just 11 million people became a soccer superpower
55,Cycling as solace: He broke his back and his life changed forever
56,"Football's coming home, but taking a knee divides England fans"
57,Playing golf when you're pregnant
58,'I was the only kid who stayed on the wall and didn't want to come off': The making of climbing superstar Janja Garnbret
59,Photographs reveal the joy and hardships of gay fatherhood in the US
60,What skeletons reveal about this painful medieval fashion trend
61,Why it cost over $300 million to develop NASA's new space suits
62,France is sending a second Statue of Liberty to the US
63,"LEGO releases 2,000-piece typewriter -- and it actually moves"
64,Why 20 million Americans are cheering
65,"As a scientist, I want to believe in UFOs, but ..."
66,"On the ACA, Obama will have the last laugh"
67,Why we're nervously celebrating Pride this month
68,Southern Baptist Convention is still at war with itself
69,What making Juneteenth a federal holiday won't do
70,New Alzheimer's drug sets dangerous precedent
71,Abrams signals openness to Manchin's voting legislation proposals
72,House votes to repeal Iraq War authorization
73,Two activists set aside personal threats to fight new voting restrictions
74,5 takeaways from the final NYC Democratic mayoral debate
75,Do you yearn for fulfillment? Try being ordinary
76,Makeup may contain potentially toxic chemicals
77,Why breathing is your superpower
78,New images help solve celestial mystery
79,You can help NASA name the mannequin heading to the moon
80,Texas authorities threaten SpaceX with legal action
81,Analysis: Windows 11 has leaked. It's a bunch of BS
82,Another hiccup for Uber: Some drivers were being charged for giving rides
83,A new problem for Peloton owners: Hacks
